{
  "schema": "vprs/v1",
  "agent_id": "ag_demo",
  "issuer_id": "vouched.uichain.org",
  "issued_at": 1791127579,
  "key_id": "vouched-2026",
  "alg": "secp256k1",
  "settlements": [
    {
      "id": "st_1",
      "task_id": "task_alpha",
      "agent_id": "ag_demo",
      "origin_agent_id": "ag_demo",
      "issuer_id": "vouched.uichain.org",
      "amount_usd": 80.0,
      "category": "data",
      "outcome": "settled",
      "rating": 5.0,
      "ts": 1690000000,
      "proof_hash": "0x1d91318b6ea457f7b2856b44e53ce28e85da3848"
    },
    {
      "id": "st_2",
      "task_id": "task_beta",
      "agent_id": "ag_demo",
      "origin_agent_id": "ag_demo",
      "issuer_id": "vouched.uichain.org",
      "amount_usd": 120.0,
      "category": "data",
      "outcome": "settled",
      "rating": 4.0,
      "ts": 1690000500,
      "proof_hash": "0xf237af74e0267ac94fa5506c4750954e39487e5b"
    },
    {
      "id": "st_3",
      "task_id": "task_gamma",
      "agent_id": "ag_demo",
      "origin_agent_id": "ag_demo",
      "issuer_id": "vouched.uichain.org",
      "amount_usd": 50.0,
      "category": "code",
      "outcome": "failed",
      "rating": 0.0,
      "ts": 1690001000,
      "proof_hash": "0x949ec605da6aa386f1b79b3923d42841fd628d74"
    }
  ],
  "summary": {
    "settled_count": 2,
    "failed_count": 1,
    "total_earned_usd": 200.0,
    "avg_rating": 4.5,
    "success_rate": 0.667,
    "reputation": 3.8,
    "score": null,
    "tier": "reliable",
    "tier_label": "可靠",
    "portable": false
  },
  "root_hash": "0x446882107c6f972c34cc92058dde8aaffe844e542cbf38c1",
  "issuer_sig": "0xa87d732d79630247bca00924134ff46f88d6e5394beb85577a9c755fd7d4713739397451142526d7bb406474278a50881fad3fe0fd5e2c96462f86b9b5774dc1"
}